job_title,company_name,location,skills_required,date_posted,job_link,job_category,work_mode,crawl_date
Lead/ Principal Front-end Engineer (ReactJS/ NextJS),"MONEY FORWARD VIETNAM CO.,LTD",Ha Noi,"ReactJS, Leadership, TypeScript, JavaScript, NextJS, English",2025-10-13 08:21:58,https://itviec.com/it-jobs/lead-principal-front-end-engineer-reactjs-nextjs-money-forward-vietnam-co-ltd-3536/content?job_index=8&locale=en&page=24,Frontend Developer,Hybrid (flexible between home and office),2025-10-21 08:45:56
Senior Automation Tester [HCM/DN - Salary Upto 3200$],Sioux High Tech Software,Ho Chi Minh - Da Nang,"Automation Test, WPF, Python, CI/CD, NUnit, C#",2025-10-13 08:22:00,https://itviec.com/it-jobs/senior-automation-tester-hcm-dn-salary-upto-3200-sioux-high-tech-software-5507/content?job_index=9&locale=en&page=24,Automation Tester,Hybrid (flexible between home and office),2025-10-21 08:45:56
"Data Engineer (Python, SQL, ETL)",Beyondsoft Technology (Vietnam) Company Limited,Ho Chi Minh,"ETL, Data Engineer, Azure, SQL, Python",2025-10-13 08:22:02,https://itviec.com/it-jobs/data-engineer-python-sql-etl-beyondsoft-technology-vietnam-company-limited-3120/content?job_index=10&locale=en&page=24,Data Engineer,At office,2025-10-21 08:45:56
"Windows Application Developer (C#, C++, WPF)",Nucare Korea,Ha Noi - Ho Chi Minh - Others,"C#, MFC, Web API, Python, Java, C++",2025-10-13 08:22:03,https://itviec.com/it-jobs/windows-application-developer-c-c-wpf-nucare-korea-1309/content?job_index=11&locale=en&page=24,Desktop Application Developer,At office,2025-10-21 08:45:56
Techlead NodeJS - US Client,VMO Holdings,Ha Noi,"English, AWS, Fullstack, NodeJS",2025-10-13 08:22:05,https://itviec.com/it-jobs/techlead-nodejs-us-client-vmo-holdings-2522/content?job_index=12&locale=en&page=24,Fullstack Developer,At office,2025-10-21 08:45:56
CV Phân tích và thiết kế Mô hình dữ liệu - Data Analys,MB Bank,Ha Noi,"Data Analysis, Power BI, Microsoft SQL Server, Oracle, SQL",2025-10-13 08:22:07,https://itviec.com/it-jobs/cv-phan-tich-va-thiet-ke-mo-hinh-du-lieu-data-analys-mb-bank-1801/content?job_index=13&locale=en&page=24,Data Analyst,At office,2025-10-21 08:45:56
"Senior Java Engineer (Spring Boot, Microservices)",EPAM Vietnam,Ho Chi Minh - Ha Noi,"Java, SOLID Principles, NoSQL, SQL, Microservices, Spring Boot",2025-10-13 08:22:08,https://itviec.com/it-jobs/senior-java-engineer-spring-boot-microservices-epam-vietnam-1504/content?job_index=14&locale=en&page=24,Backend Developer,"Remotely, Floor 13, MB Sunny Tower, 259 Tran Hung Dao, Co Giang ward, District 1, Ho Chi Minh",2025-10-21 08:45:56
"Viedoc-Senior Fullstack .NET Developer (C#,React,Azure)",Scandinavian Software Park,Ha Noi,".NET, System Architecture, ReactJS, Azure, SQL, English",2025-10-13 08:22:10,https://itviec.com/it-jobs/viedoc-senior-fullstack-net-developer-c-react-azure-scandinavian-software-park-5432/content?job_index=15&locale=en&page=24,Fullstack Developer,At office,2025-10-21 08:45:56
"Cloud Solution Architect (AWS) (Senior, Junior)",MEGAZONE,Ha Noi,"Solution Architecture, System Architecture, Cloud-native Architecture, Presale, Cloud, AWS",2025-10-13 08:22:12,https://itviec.com/it-jobs/cloud-solution-architect-aws-senior-junior-megazone-2503/content?job_index=16&locale=en&page=24,Solution Architect,At office,2025-10-21 08:45:56
Data Engineer (SQL/ Python/ Cloud),MEGAZONE,Ha Noi,"Data Engineer, MLOps, Database, Data Warehousing, Databricks, Big Data",2025-10-13 08:22:13,https://itviec.com/it-jobs/data-engineer-sql-python-cloud-megazone-5539/content?job_index=17&locale=en&page=24,Data Engineer,At office,2025-10-21 08:45:56
"Middle/Senior Data Analysis (Power BI, SQL, English)",Aletech Technology Solutions Company,Ha Noi,"Data Analysis, Power BI, Data Science, Database, Business Intelligence, SQL",2025-10-13 08:22:15,https://itviec.com/it-jobs/middle-senior-data-analysis-power-bi-sql-english-aletech-technology-solutions-company-3824/content?job_index=18&locale=en&page=24,Data Analyst,At office,2025-10-21 08:45:56
"Games Developer (Cocos, JavaScript/TypeScript)",Vinsprite Soft,Ho Chi Minh,"TypeScript, JavaScript, Cocos Creator, Games, Cocos, English",2025-10-13 08:22:17,https://itviec.com/it-jobs/games-developer-cocos-javascript-typescript-vinsprite-soft-0526/content?job_index=19&locale=en&page=24,Frontend Developer,At office,2025-10-21 08:45:56
Games Backend Golang Engineer,Vinsprite Soft,Ho Chi Minh,"Golang, Games, Docker, MySQL, Kafka, English",2025-10-13 08:22:27,https://itviec.com/it-jobs/games-backend-golang-engineer-vinsprite-soft-0518/content?job_index=0&locale=en&page=25,Backend Developer,At office,2025-10-21 08:45:56
[HN] Data Analyst (Up to 1000$),Giao Hàng Tiết Kiệm,Ha Noi,"Data Analysis, R, Python, Power BI, SQL",2025-10-13 08:22:29,https://itviec.com/it-jobs/hn-data-analyst-up-to-1000-giao-hang-tiet-kiem-4907/content?job_index=1&locale=en&page=25,Data Analyst,At office,2025-10-21 08:45:56
"Junior - Middle Quality Engineer (QA, Tester)",Coder Trove,Ho Chi Minh,"QA QC, Tester",2025-10-13 08:22:30,https://itviec.com/it-jobs/junior-middle-quality-engineer-qa-tester-coder-trove-2248/content?job_index=2&locale=en&page=25,Manual Tester,Hybrid (flexible between home and office),2025-10-21 08:45:56
"Senior Java Backend Developer (Spring Boot, SQL, NoSQL)",CÔNG TY CỔ PHẦN CITICS,Ho Chi Minh,"Java, Spring, SQL, NoSQL, Agile, Spring Boot",2025-10-13 08:22:32,https://itviec.com/it-jobs/senior-java-backend-developer-spring-boot-postgresql-cong-ty-co-phan-citics-0854/content?job_index=3&locale=en&page=25,Backend Developer,At office,2025-10-21 08:45:56
Project Management (Agile/Scrum),HIỆP HỘI DỮ LIỆU QUỐC GIA (National Data Association),Ha Noi,"Project Management, English, Jira, API, Scrum, Agile",2025-10-13 08:22:34,https://itviec.com/it-jobs/project-management-agile-scrum-hiep-hoi-du-lieu-quoc-gia-national-data-association-2231/content?job_index=4&locale=en&page=25,Project Manager,At office,2025-10-21 08:45:56
IOS Developer (Swift/C++),TOHSoft,Ha Noi,"Swift, JSON, iOS, UI-UX, C++, Objective C",2025-10-12 08:22:35,https://itviec.com/it-jobs/ios-developer-swift-c-tohsoft-5556/content?job_index=5&locale=en&page=25,Mobile Application Developer,At office,2025-10-21 08:45:56
(Đống Đa HN) Python Developer (Flask/Django/AWS),Neos Việt Nam,Ha Noi,"Python, AWS Lambda, Flask, AWS, Django",2025-10-12 08:22:37,https://itviec.com/it-jobs/dong-da-hn-python-developer-flask-django-aws-neos-viet-nam-0725/content?job_index=6&locale=en&page=25,Backend Developer,At office,2025-10-21 08:45:56
DevOps Engineer (Network and Security Engineer L2),CODE88 COMPANY LIMITED,Ho Chi Minh,"Cloud Security, Linux, DevSecOps",2025-10-12 08:22:39,https://itviec.com/it-jobs/devops-engineer-network-and-security-engineer-l2-code88-company-limited-0243/content?job_index=7&locale=en&page=25,DevSecOps Engineer,At office,2025-10-21 08:45:56
Python Backend Developer (Hybrid Work),LHV Software,Ho Chi Minh,"Python, AWS, Django, English",2025-10-12 08:22:40,https://itviec.com/it-jobs/python-backend-developer-hybrid-work-lhv-software-1857/content?job_index=8&locale=en&page=25,Backend Developer,Hybrid (flexible between home and office),2025-10-21 08:45:56
"Middle/Senior Mobile Developer (Flutter, Dart, CI/CD)",DNSE,Ha Noi,"Flutter, Mobile Apps, CI/CD, Figma, UI-UX, Dart",2025-10-12 08:22:42,https://itviec.com/it-jobs/middle-senior-mobile-developer-flutter-dart-ci-cd-dnse-2715/content?job_index=9&locale=en&page=25,Mobile Application Developer,At office,2025-10-21 08:45:56
Sr/Jr AI Engineer (Prompt Engineer Open AI),Silicon Prime Labs,Ho Chi Minh,"AI, Machine Learning, Python, JavaScript",2025-10-12 08:22:44,https://itviec.com/it-jobs/sr-jr-ai-engineer-prompt-engineer-open-ai-silicon-prime-labs-5953/content?job_index=10&locale=en&page=25,AI / Machine Learning Engineer,At office,2025-10-21 08:45:56
CVCC Vận hành Nền tảng dịch vụ khách hàng - K.CNTT,PVcomBank,Ha Noi,"DevOps, BPMN, Docker, Kubernetes, Spring Boot, JavaScript",2025-10-12 08:22:45,https://itviec.com/it-jobs/cvcc-van-hanh-nen-tang-dich-vu-khach-hang-k-cntt-pvcombank-5621/content?job_index=11&locale=en&page=25,DevOps Engineer,At office,2025-10-21 08:45:56
"Senior Golang Backend Developer (English, DevOps)",ekino Vietnam,Ho Chi Minh,"Golang, Azure, PostgreSql, Microservices, DevOps, English",2025-10-12 08:22:47,https://itviec.com/it-jobs/senior-golang-developer-english-required-devops-ekino-vietnam-4754/content?job_index=12&locale=en&page=25,Backend Developer,At office,2025-10-21 08:45:56
"Unity Engineer (Games, WebGL, English)",HYPE REEL VIETNAM,Ho Chi Minh,"Unity, English, Mobile Apps, Algorithms, Blockchain, Games",2025-10-12 08:22:49,https://itviec.com/it-jobs/unity-engineer-games-webgl-english-hype-reel-vietnam-1346/content?job_index=13&locale=en&page=25,Game Developer,At office,2025-10-21 08:45:56
"Product Management (Games, English)",HYPE REEL VIETNAM,Ho Chi Minh,"Product Management, Blockchain, Project Management, Product Owner, English, Games",2025-10-12 08:22:50,https://itviec.com/it-jobs/product-management-games-english-hype-reel-vietnam-1646/content?job_index=14&locale=en&page=25,Product Manager,At office,2025-10-21 08:45:56
"Senior QA/QC (Tester, Agile)",Silicon Prime Labs,Ho Chi Minh,"Tester, QA QC, Agile",2025-10-12 08:22:52,https://itviec.com/it-jobs/senior-qa-qc-tester-agile-silicon-prime-labs-5651/content?job_index=15&locale=en&page=25,Manual Tester,At office,2025-10-21 08:45:56
Trưởng phòng Phân tích & Khai thác Dữ liệu,Ngân hàng TMCP Tiên Phong | TPBank,Ha Noi,"Team Management, AWS, CI/CD, Python, Power BI, Database",2025-10-11 08:22:54,https://itviec.com/it-jobs/truong-phong-phan-tich-khai-thac-du-lieu-ngan-hang-tmcp-tien-phong-tpbank-4859/content?job_index=16&locale=en&page=25,Manager,At office,2025-10-21 08:45:56
Japanese Bridge Engineer (BrSE/IT Comtor/NO CODE),Intelligent T&E (ExecutionLab),Ho Chi Minh,"Bridge Engineer, Japanese IT Communication, Japanese, Project Management",2025-10-11 08:22:55,https://itviec.com/it-jobs/japanese-bridge-engineer-brse-it-comtor-no-code-intelligent-t-e-executionlab-1622/content?job_index=17&locale=en&page=25,Bridge System Engineer (BrSE),At office,2025-10-21 08:45:56
"Principal Developer (JavaScript, CRM)",Sun Life Vietnam Insurance Company Limited,Ho Chi Minh,"JavaScript, AWS, DevOps, API, Salesforce, Apex",2025-10-11 08:22:57,https://itviec.com/it-jobs/principal-developer-javascript-crm-sun-life-vietnam-insurance-company-limited-2754/content?job_index=18&locale=en&page=25,Enterprise Application Developer (CRM),At office,2025-10-21 08:45:56
Senior Cyber Security Operations (SecOps/SOC Analyst),One Mount Group,Ha Noi,"Cybersecurity, Python, Vulnerability Management, EDR, SOAR, SIEM",2025-10-11 08:22:59,https://itviec.com/it-jobs/senior-cyber-security-operations-secops-soc-analyst-one-mount-group-0115/content?job_index=19&locale=en&page=25,DevSecOps Engineer,At office,2025-10-21 08:45:56
Dev Ops + BE Engineer,AcceleratorApp,Others,"DevOps, JavaScript, Kubernetes, Terraform, CI/CD, AWS",2025-10-11 08:23:09,https://itviec.com/it-jobs/dev-ops-be-engineer-acceleratorapp-4747/content?job_index=0&locale=en&page=26,DevOps Engineer,Remote (don't have to come to the office),2025-10-21 08:45:56
AI Engineer (Behavioral Analysis / Fintech)-High Salary,TJ Tech,Ha Noi,"AI, SQL, TensorFlow, Python, Deep Learning, Machine Learning",2025-10-11 08:23:11,https://itviec.com/it-jobs/ai-engineer-behavioral-analysis-fintech-high-salary-tj-tech-2104/content?job_index=1&locale=en&page=26,AI / Machine Learning Engineer,At office,2025-10-21 08:45:56
Business Analyst (ERP – Tài chính Kế toán),SSI Securities Corporation,Ha Noi,"Business Analysis, ERP",2025-10-11 08:23:12,https://itviec.com/it-jobs/business-analyst-erp-tai-chinh-ke-toan-ssi-securities-corporation-0209/content?job_index=2&locale=en&page=26,Business Analyst,At office,2025-10-21 08:45:56
Backend Developer (JavaScript/TypeScript/NestJS/SQL),MenuCoster,Ha Noi - Ho Chi Minh - Da Nang,"JavaScript, NestJS, Database, MySQL, TypeScript, SQL",2025-10-11 08:23:14,https://itviec.com/it-jobs/backend-developer-javascript-typescript-nestjs-sql-menucoster-4457/content?job_index=3&locale=en&page=26,Backend Developer,At office,2025-10-21 08:45:56
Senior Software Engineer (IoT),Masterise Group,Ha Noi,"IoT, Spring Boot, C++, Spring, Java",2025-10-11 08:23:16,https://itviec.com/it-jobs/senior-software-engineer-iot-masterise-group-2023/content?job_index=4&locale=en&page=26,Backend Developer,At office,2025-10-21 08:45:56
"Full Stack Developer (Java, Springboot, React)",LG CNS Việt Nam,Ha Noi,"Java, AWS, HTML, JavaScript, Spring Boot, ReactJS",2025-10-11 08:23:17,https://itviec.com/it-jobs/full-stack-developer-java-springboot-react-lg-cns-viet-nam-1342/content?job_index=5&locale=en&page=26,Fullstack Developer,At office,2025-10-21 08:45:56
".NET Developer (ERP, C#, JavaScript, SQL)",Công ty cổ phần giải pháp First Trust Việt Nam,Ha Noi,".NET, ERP, Microsoft SQL Server, JavaScript, ASP.NET, C#",2025-10-11 08:23:19,https://itviec.com/it-jobs/net-developer-c-javascript-html5-cong-ty-co-phan-giai-phap-first-trust-viet-nam-3415/content?job_index=6&locale=en&page=26,ERP Developer,At office,2025-10-21 08:45:56
IT Software Manager (NodeJS/ReactJS/Database/SQL ),CÔNG TY TRÁCH NHIỆM HỮU HẠN VIPHAP,Ha Noi,"Team Management, Database, NoSQL, SQL, ReactJS, NodeJS",2025-10-11 08:23:21,https://itviec.com/it-jobs/it-software-manager-nodejs-reactjs-database-sql-cong-ty-trach-nhiem-huu-han-viphap-4144/content?job_index=7&locale=en&page=26,Manager,At office,2025-10-21 08:45:56
Assistant IT Manager (Transporation Management System),KLN Logistics Việt Nam,Binh Duong,"Business Analysis, Team Management, English, Jira, IT Communication/Translation",2025-10-11 08:23:22,https://itviec.com/it-jobs/team-lead-business-analyst-kln-logistics-viet-nam-0808/content?job_index=8&locale=en&page=26,Manager,At office,2025-10-21 08:45:56
AI Technical Lead / Solution Architect,Horse AI,Ha Noi - Hung Yen,"Solution Architecture, Computer Vision, Machine Learning, AI, Leadership",2025-10-11 08:23:24,https://itviec.com/it-jobs/ai-technical-lead-solution-architect-horse-ai-4027/content?job_index=9&locale=en&page=26,Solution Architect,"Remote/Hybrid, Dong Da, Ha Noi",2025-10-21 08:45:56
Sr Fullstack Developer (Microsoft 365/Office Adds-in),Scandinavian Software Park,Ha Noi,"Microsoft Dynamics 365, Microsoft Power Apps, VueJS, TypeScript, PHP, JavaScript",2025-10-11 08:23:26,https://itviec.com/it-jobs/sr-fullstack-developer-microsoft-365-office-adds-in-scandinavian-software-park-3053/content?job_index=10&locale=en&page=26,Fullstack Developer,At office,2025-10-21 08:45:56
"System Engineer (ERP, SQL, ASP.NET, C#)",Công Ty Cổ Phần Thú Y Xanh,Ha Noi,"System Admin, C#, ASP.NET, VBA, MySQL, SQL",2025-10-11 08:23:27,https://itviec.com/it-jobs/system-engineer-erp-sql-asp-net-c-cong-ty-co-phan-thu-y-xanh-1821/content?job_index=11&locale=en&page=26,Systems Engineer / Administrator,At office,2025-10-21 08:45:56
Unity Developer (Casual/Puzzle) - Junior/Middle,Công ty cổ phần công nghệ Skymare,Ha Noi,"Unity, Games, OOP, C#",2025-10-11 08:23:29,https://itviec.com/it-jobs/unity-developer-casual-puzzle-junior-middle-cong-ty-co-phan-cong-nghe-skymare-0121/content?job_index=12&locale=en&page=26,Game Developer,At office,2025-10-21 08:45:56
Manual Tester (QA QC),CÔNG TY TNHH PIONEERA,Ha Noi,"Tester, QA QC, Smart contracts, Blockchain, Web3.js",2025-10-11 08:23:31,https://itviec.com/it-jobs/manual-tester-qa-qc-cong-ty-tnhh-pioneera-3515/content?job_index=13&locale=en&page=26,Manual Tester,At office,2025-10-21 08:45:56
"Product Owner/ Product Manager (BA, Agile/Scrum)",CÔNG TY TNHH PIONEERA,Ha Noi,"Product Owner, Scrum, Product Management, Business Analysis, Agile, Blockchain",2025-10-11 08:23:32,https://itviec.com/it-jobs/product-owner-product-manager-ba-agile-scrum-cong-ty-tnhh-pioneera-3704/content?job_index=14&locale=en&page=26,Product Owner,At office,2025-10-21 08:45:56
Networking & System Engineer (CCTV / Smarthome / IoT),Công Ty Cổ Phần Nhà An Toàn,Ha Noi,"Networking, IoT, Firewall, Cisco, System Admin",2025-10-11 08:23:34,https://itviec.com/it-jobs/networking-system-engineer-cctv-smarthome-iot-cong-ty-co-phan-nha-an-toan-5706/content?job_index=15&locale=en&page=26,Technical Consultant,At office,2025-10-21 08:45:56
Senior IT Risks Management Specialist,MB Bank,Ha Noi,"Risk Management, Pentest, Tableau, Data Analysis, Python, SQL",2025-10-11 08:23:36,https://itviec.com/it-jobs/senior-it-risks-management-specialist-mb-bank-5958/content?job_index=16&locale=en&page=26,IT Auditor / IT Risk Manager,At office,2025-10-21 08:45:56
[Sign-on Bonus] Backend Technical Lead - $70K/year,Crossian,Ha Noi,".NET, Cloud-native Architecture, LINQ, Leadership, C#, AWS",2025-10-11 08:23:37,https://itviec.com/it-jobs/sign-on-bonus-backend-technical-lead-70k-year-crossian-5424/content?job_index=17&locale=en&page=26,Backend Developer,At office,2025-10-21 08:45:56
"Data Crawler Engineer (Web Scraping, Python)",CÔNG TY CỔ PHẦN SOLVITECH,Ha Noi,"Data Engineer, Data Warehousing, NoSQL, SQL, Machine Learning, Data cleaning",2025-10-11 08:23:39,https://itviec.com/it-jobs/data-crawler-engineer-web-scraping-python-cong-ty-co-phan-solvitech-4359/content?job_index=18&locale=en&page=26,Data Engineer,At office,2025-10-21 08:45:56
Fresher Android Developer (Kotlin/ Java/ Mobile Apps),WECAN MOBILE COMPANY LIMITED,Ha Noi,"Android, Mobile Apps, MVVM, Clean Architecture, Kotlin, Java",2025-10-11 08:23:41,https://itviec.com/it-jobs/fresher-android-developer-kotlin-java-mobile-apps-wecan-mobile-company-limited-5205/content?job_index=19&locale=en&page=26,Mobile Application Developer,At office,2025-10-21 08:45:56
Quality Control Engineer (Senior/Lead),EMESOFT,Ho Chi Minh,"Tester, Scrum, Postman, Jira, QA QC, English",2025-10-11 08:23:51,https://itviec.com/it-jobs/quality-control-engineer-senior-lead-emesoft-3922/content?job_index=0&locale=en&page=27,Manual Tester,At office,2025-10-21 08:45:56
"Android HMI SDK Dev (UI/UX, Jetpack Compose, Kotlin)",Suntech Vina (Hợp tác cùng tập đoàn CNTT hàng đầu Ấn độ),Ha Noi,"Android, Embedded Android, Git, Kotlin, SOLID Principles, UI-UX",2025-10-11 08:23:53,https://itviec.com/it-jobs/android-hmi-sdk-dev-ui-ux-jetpack-compose-kotlin-suntech-vina-hop-tac-cung-tap-doan-cntt-hang-dau-an-do-0557/content?job_index=1&locale=en&page=27,Mobile Application Developer,At office,2025-10-21 08:45:56
"Fullstack Developer (NodeJS, Python, Cloud)","Resolve Computing Services Co., Ltd",Ha Noi,"NodeJS, HTML, JavaScript, Cloud, PostgreSql, Python",2025-10-11 08:23:54,https://itviec.com/it-jobs/fullstack-developer-nodejs-python-cloud-resolve-computing-services-co-ltd-3415/content?job_index=2&locale=en&page=27,Fullstack Developer,At office,2025-10-21 08:45:56
[Remote/Hybrid] Backend Engineer (Scala/Golang/Kotlin),Semrush,Ho Chi Minh - Da Nang - Ha Noi,"Scala, Java, Golang, Kotlin, Software Architecture, English",2025-10-11 08:23:56,https://itviec.com/it-jobs/remote-hybrid-backend-engineer-scala-golang-kotlin-semrush-5948/content?job_index=3&locale=en&page=27,Backend Developer,"Remote All Vietnam, Cam Le, Da Nang",2025-10-21 08:45:56
Engineering Manager,HipVan,Ho Chi Minh,"Team Management, JavaScript, Kotlin, Swift, Ruby on Rails, Software Architecture",2025-10-11 08:23:58,https://itviec.com/it-jobs/engineering-manager-hipvan-5227/content?job_index=4&locale=en&page=27,Manager,At office,2025-10-21 08:45:56
"Lead Android Engineer (Java, Kotlin)",NAB Innovation Centre Vietnam,Ho Chi Minh,"Android studio, Clean Architecture, MVVM, Java, Kotlin",2025-10-11 08:23:59,https://itviec.com/it-jobs/lead-android-engineer-java-kotlin-nab-innovation-centre-vietnam-2720/content?job_index=5&locale=en&page=27,Mobile Application Developer,Hybrid (flexible between home and office),2025-10-21 08:45:56
"Sr AI Manager (Data Analysis, Machine Learning, Python)",Công Ty Cổ Phần Tập Đoàn Meey Land,Ha Noi,"AI, Big Data, Machine Learning, Data Analysis, Team Management, Python",2025-10-11 08:24:01,https://itviec.com/it-jobs/sr-ai-manager-data-analysis-machine-learning-python-cong-ty-co-phan-tap-doan-meey-land-0641/content?job_index=6&locale=en&page=27,AI / Machine Learning Engineer,At office,2025-10-21 08:45:56
"Project Manager (Japanese N2+, Onsite Japan)",NEC Vietnam,Ho Chi Minh - Ha Noi,"Project Management, Bridge Engineer, Japanese IT Communication, Stakeholder management, Japanese, Team Management",2025-10-11 08:24:03,https://itviec.com/it-jobs/project-manager-japanese-n2-onsite-japan-nec-vietnam-1255/content?job_index=7&locale=en&page=27,Project Manager,Hybrid (flexible between home and office),2025-10-21 08:45:56
Gameplay Developer (C++),Gameloft,Ho Chi Minh,"C++, Games, OOP",2025-10-11 08:24:04,https://itviec.com/it-jobs/gameplay-developer-c-gameloft-5534/content?job_index=8&locale=en&page=27,Game Developer,Hybrid (flexible between home and office),2025-10-21 08:45:56
Senior Python Developer (Django),Open Web Technology,Da Nang,"Python, DevOps, AI, SQL, English, Django",2025-10-10 08:24:06,https://itviec.com/it-jobs/senior-python-developer-django-open-web-technology-4531/content?job_index=9&locale=en&page=27,Backend Developer,Hybrid (flexible between home and office),2025-10-21 08:45:56
Senior Automation Tester (Sign-on Bonus),Pizza Hut Digital & Technology,Ho Chi Minh,"Automation Test, CI/CD, BrowserStack, Appium, JavaScript, English",2025-10-10 08:24:08,https://itviec.com/it-jobs/senior-automation-tester-sign-on-bonus-pizza-hut-digital-technology-3508/content?job_index=10&locale=en&page=27,Automation Tester,Hybrid (flexible between home and office),2025-10-21 08:45:56
Chuyên Viên Phát Triển Khoa Học Dữ Liệu- Data Scientist,MB Bank,Ha Noi,"Data Science, Big Data, Database, AI",2025-10-10 08:24:09,https://itviec.com/it-jobs/chuyen-vien-phat-trien-khoa-hoc-du-lieu-data-scientist-mb-bank-0744/content?job_index=11&locale=en&page=27,Data Scientist,At office,2025-10-21 08:45:56
Kỹ sư phát triển giải pháp Oracle - Database Developer,MB Bank,Ha Noi,"Database, ETL, Java, PL/SQL, Oracle, SQL",2025-10-10 08:24:11,https://itviec.com/it-jobs/ky-su-phat-trien-giai-phap-oracle-database-developer-mb-bank-0704/content?job_index=12&locale=en&page=27,Database Administrator,At office,2025-10-21 08:45:56
AI Engineer (Computer Vision/NPL/LLM),MB Bank,Ha Noi,"AI, Flask, Computer Vision, Microservices, C++, Python",2025-10-10 08:24:13,https://itviec.com/it-jobs/ai-engineer-computer-vision-npl-llm-mb-bank-3015/content?job_index=13&locale=en&page=27,AI / Machine Learning Engineer,At office,2025-10-21 08:45:56
"Solution Architect (open for SA, Devlead)",MB Bank,Ha Noi,"Solution Architecture, Redis, Java, Microservices, Cloud, Oracle",2025-10-10 08:24:14,https://itviec.com/it-jobs/solution-architect-open-for-sa-devlead-mb-bank-2738/content?job_index=14&locale=en&page=27,Solution Architect,At office,2025-10-21 08:45:56
Security / DevSecOps Engineer,TECHNOLOGY ORBIT,Ho Chi Minh,"Security, Metasploit, OWASP, Information Security, DevSecOps, Pentest",2025-10-10 08:24:16,https://itviec.com/it-jobs/security-devsecops-engineer-technology-orbit-2646/content?job_index=15&locale=en&page=27,Security Engineer,At office,2025-10-21 08:45:56
Senior Business Analyst /Technical Writer,GrapeCity,Ha Noi,"Business Analysis, BRD, Jira, English",2025-10-10 08:24:18,https://itviec.com/it-jobs/senior-business-analyst-technical-writer-grapecity-5939/content?job_index=16&locale=en&page=27,Business Analyst,At office,2025-10-21 08:45:56
"Web Frontend Developer (Angular/ NextJS, JavaScript)",YouMed Việt Nam,Ho Chi Minh,"JavaScript, Agile, TypeScript, HTML, Angular, NextJS",2025-10-10 08:24:19,https://itviec.com/it-jobs/frontend-web-developer-angular-nextjs-youmed-viet-nam-0237/content?job_index=17&locale=en&page=27,Frontend Developer,At office,2025-10-21 08:45:56
Technical Lead (DevOps/ Machine Learning/ AI/ Python),Techvify,Ha Noi,"Team Management, ReactJS, Python, DevOps, Java, AI",2025-10-10 08:24:21,https://itviec.com/it-jobs/technical-lead-devops-machine-learning-ai-python-techvify-software-4909/content?job_index=18&locale=en&page=27,Fullstack Developer,At office,2025-10-21 08:45:56
Mid/Senior Backend (Ruby/Python/NodeJS/Java preferred),Employment Hero,Ho Chi Minh,"Ruby on Rails, English, NodeJS, Java, JavaScript, Python",2025-10-10 08:24:23,https://itviec.com/it-jobs/mid-senior-backend-ruby-python-nodejs-java-preferred-employment-hero-0524/content?job_index=19&locale=en&page=27,Backend Developer,Remote (don't have to come to the office),2025-10-21 08:45:56
"Product Owner (ERP/CRM, IFRS & Odoo)",GON TECH,Ho Chi Minh,"Product Owner, English, Jira, CRM, ERP, Odoo",2025-10-10 08:24:33,https://itviec.com/it-jobs/product-owner-erp-crm-ifrs-odoo-gon-tech-3904/content?job_index=0&locale=en&page=28,Product Owner,At office,2025-10-21 08:45:56
Senior Backend Engineer,HipVan,Ho Chi Minh,"Ruby on Rails, NodeJS",2025-10-10 08:24:35,https://itviec.com/it-jobs/senior-backend-engineer-hipvan-2307/content?job_index=1&locale=en&page=28,Backend Developer,At office,2025-10-21 08:45:56
Generative Game Artist (Contractor),Athena Studio,Ho Chi Minh,"Games, Design, UI-UX, Adobe Photoshop, Generative AI, AI",2025-10-10 08:24:36,https://itviec.com/it-jobs/generative-game-artist-contractor-athena-studio-4653/content?job_index=2&locale=en&page=28,Game Designer,At office,2025-10-21 08:45:56
Project Manager cum Business Analyst (Agile/Scrum),TJ Tech,Ha Noi,"Business Analysis, Agile, Japanese, English, Project Management",2025-10-10 08:24:38,https://itviec.com/it-jobs/project-manager-cum-business-analyst-agile-scrum-tj-tech-1120/content?job_index=3&locale=en&page=28,AI / Machine Learning Engineer,At office,2025-10-21 08:45:56
