job_title,company_name,location,skills_required,date_posted,job_link,job_category,work_mode,crawl_date
[2.1] Pentest / Threat Hunting,TRUNG TÂM THÔNG TIN TÍN DỤNG QUỐC GIA VIỆT NAM (CIC),Ha Noi,"Pentest, Firewall, Security, ThreadX",2025-10-19 02:28:09,https://itviec.com/it-jobs/2-1-pentest-threat-hunting-trung-tam-thong-tin-tin-dung-quoc-gia-viet-nam-cic-2525/content?job_index=11&locale=en&page=12,Security Tester / Penetration Tester,At office,2025-10-25 03:01:43
[3.1] IT System / Hardware Administrator,TRUNG TÂM THÔNG TIN TÍN DỤNG QUỐC GIA VIỆT NAM (CIC),Ha Noi,"System Admin, Cloud, AWS",2025-10-19 02:28:11,https://itviec.com/it-jobs/3-1-it-system-hardware-administrator-trung-tam-thong-tin-tin-dung-quoc-gia-viet-nam-cic-2556/content?job_index=12&locale=en&page=12,Systems Engineer / Administrator,At office,2025-10-25 03:01:43
[3.2] Network Engineer,TRUNG TÂM THÔNG TIN TÍN DỤNG QUỐC GIA VIỆT NAM (CIC),Ha Noi,"Networking, System Admin, Cloud",2025-10-19 02:28:12,https://itviec.com/it-jobs/3-2-network-engineer-trung-tam-thong-tin-tin-dung-quoc-gia-viet-nam-cic-2719/content?job_index=13&locale=en&page=12,Network Engineer,At office,2025-10-25 03:01:43
[5.1] Big Data / AI Engineer,TRUNG TÂM THÔNG TIN TÍN DỤNG QUỐC GIA VIỆT NAM (CIC),Ha Noi,"AI, Machine Learning, Big Data",2025-10-19 02:28:14,https://itviec.com/it-jobs/5-1-big-data-ai-engineer-trung-tam-thong-tin-tin-dung-quoc-gia-viet-nam-cic-2809/content?job_index=14&locale=en&page=12,Big Data Engineer,At office,2025-10-25 03:01:43
[1] An toàn thông tin an ninh bảo mật,TRUNG TÂM THÔNG TIN TÍN DỤNG QUỐC GIA VIỆT NAM (CIC),Ha Noi,"Security, Networking, Cybersecurity, Pentest, English",2025-10-19 02:28:16,https://itviec.com/it-jobs/1-an-toan-thong-tin-an-ninh-bao-mat-trung-tam-thong-tin-tin-dung-quoc-gia-viet-nam-cic-1939/content?job_index=15&locale=en&page=12,Security Engineer,At office,2025-10-25 03:01:43
"Developer Experience Engineer (English, DevOps)","Rakuten Fintech Vietnam Co., Ltd.",Ho Chi Minh,"GitHub Actions, Docker, Cloud, AWS, DevOps",2025-10-19 02:28:17,https://itviec.com/it-jobs/developer-experience-engineer-english-devops-rakuten-fintech-vietnam-co-ltd-1751/content?job_index=16&locale=en&page=12,DevOps Engineer,At office,2025-10-25 03:01:43
Mid/Sr Java Developer (English Required) - Up to 3200$,"Rakuten Fintech Vietnam Co., Ltd.",Ho Chi Minh,"Java, Spring Boot, Spring, SQL, English",2025-10-19 02:28:19,https://itviec.com/it-jobs/mid-sr-java-developer-english-required-up-to-3200-rakuten-fintech-vietnam-co-ltd-1532/content?job_index=17&locale=en&page=12,Backend Developer,At office,2025-10-25 03:01:43
Senior PHP Software Engineer (New Project),Rakus Vietnam Company,Ho Chi Minh,"PHP, Technical Writing, PostgreSql, Solution Architecture, JavaScript",2025-10-18 02:28:21,https://itviec.com/it-jobs/senior-php-software-engineer-new-project-rakus-vietnam-company-2549/content?job_index=18&locale=en&page=12,Fullstack Developer,At office,2025-10-25 03:01:43
"Java Engineer (Spring, Junit) From 3 Years",Rakus Vietnam Company,Ho Chi Minh,"Java, GitHub, PostgreSql, JUnit, Spring, JavaScript",2025-10-18 02:28:22,https://itviec.com/it-jobs/java-engineer-spring-junit-from-3-years-rakus-vietnam-company-4653/content?job_index=19&locale=en&page=12,Fullstack Developer,At office,2025-10-25 03:01:43
DevOps Engineer,Bestarion,Ho Chi Minh,"English, DevOps",2025-10-18 02:28:33,https://itviec.com/it-jobs/devops-engineer-bestarion-3017/content?job_index=0&locale=en&page=13,Cloud Engineer,Hybrid (flexible between home and office),2025-10-25 03:01:43
Test Automation Engineer (System Focus),Motorola Solutions,Ho Chi Minh,"Python, Microservices Architecture, Jenkins, Selenium",2025-10-18 02:28:34,https://itviec.com/it-jobs/test-automation-engineer-system-focus-motorola-solutions-5417/content?job_index=1&locale=en&page=13,Software Engineer in Test (SDET),At office,2025-10-25 03:01:43
Senior QA Automation Engineer,Motorola Solutions,Ho Chi Minh,"Selenium, Postman, CI/CD",2025-10-18 02:28:36,https://itviec.com/it-jobs/senior-qa-automation-engineer-motorola-solutions-3601/content?job_index=2&locale=en&page=13,Software Engineer in Test (SDET),At office,2025-10-25 03:01:43
"Fullstack Developer (Python, Django, MySQL)",Asilla,Ha Noi,"Python, MySQL, Django",2025-10-18 02:28:38,https://itviec.com/it-jobs/fullstack-developer-python-django-mysql-asilla-1247/content?job_index=3&locale=en&page=13,Fullstack Developer,At office,2025-10-25 03:01:43
Delivery Team Leader,Home Credit Vietnam,Ho Chi Minh,"Business Analysis, Product Management, Stakeholder management, English",2025-10-18 02:28:39,https://itviec.com/it-jobs/delivery-team-leader-home-credit-vietnam-4634/content?job_index=4&locale=en&page=13,IT Consultant,At office,2025-10-25 03:01:43
"Senior Frontend Engineer (ReactJS, NextJS)","Thunder Solutions Co., Ltd.",Ho Chi Minh,"ReactJS, NextJS, TypeScript, JavaScript, CSS",2025-10-18 02:28:41,https://itviec.com/it-jobs/senior-frontend-engineer-reactjs-nextjs-thunder-solutions-co-ltd-5127/content?job_index=5&locale=en&page=13,Frontend Developer,At office,2025-10-25 03:01:43
Product Leader,Simple Tech Investment,Ho Chi Minh,"Product Management, Scrum, Data-driven, Mobile Apps, Product strategy, Agile",2025-10-18 02:28:43,https://itviec.com/it-jobs/product-leader-simple-tech-investment-5443/content?job_index=6&locale=en&page=13,Fullstack Developer,At office,2025-10-25 03:01:43
Senior Product Owner,Simple Tech Investment,Ho Chi Minh - Ha Noi,"Product Owner, Design, IT Communication/Translation, Data-driven, Agile",2025-10-18 02:28:44,https://itviec.com/it-jobs/senior-product-owner-simple-tech-investment-4204/content?job_index=7&locale=en&page=13,Fullstack Developer,At office,2025-10-25 03:01:43
[Sign-on Bonus] Senior .Net Backend Engineer -Upto $55K,Crossian,Ha Noi,".NET, LINQ, C#, .Net Core, Microservices, ASP.NET",2025-10-18 02:28:46,https://itviec.com/it-jobs/sign-on-bonus-senior-net-backend-engineer-upto-55k-crossian-4434/content?job_index=8&locale=en&page=13,Backend Developer,At office,2025-10-25 03:01:43
[Sign-on Bonus] Sr Quality Engineer -Up 30 months' pay,Crossian,Ha Noi,"Tester, Cucumber, API, Automation Test, Jira, QA QC",2025-10-18 02:28:48,https://itviec.com/it-jobs/sign-on-bonus-sr-quality-engineer-up-30-months-pay-crossian-4350/content?job_index=9&locale=en&page=13,Test Coordinator / QAQC Coordinator,At office,2025-10-25 03:01:43
Middle Frontend Developer (Angular),Oivan,Ho Chi Minh,"Angular, TypeScript, CSS",2025-10-18 02:28:49,https://itviec.com/it-jobs/middle-frontend-developer-angular-oivan-3043/content?job_index=10&locale=en&page=13,Frontend Developer,Hybrid (flexible between home and office),2025-10-25 03:01:43
"Senior Native Mobile Developer (iOS, Android, Java)",WTECH VIETNAM,Ho Chi Minh,"Android, Kotlin, Objective C, Java, Flutter, iOS",2025-10-18 02:28:51,https://itviec.com/it-jobs/senior-native-mobile-developer-ios-android-wtech-vietnam-5659/content?job_index=11&locale=en&page=13,Mobile Application Developer,At office,2025-10-25 03:01:43
Senior Golang Dev/Tech Lead (Go/English),Ada Beat Vietnam,Ho Chi Minh,"Golang, Jenkins, Scrum, Agile, Python, English",2025-10-18 02:28:53,https://itviec.com/it-jobs/senior-golang-dev-tech-lead-go-english-ada-beat-vietnam-3736/content?job_index=12&locale=en&page=13,Backend Developer,"F10, Thien Nam Office Building, No. 111 - 121 Ngo Gia Tu Street, Ward 02, District 10, Ho Chi Minh",2025-10-25 03:01:43
"Chuyên viên cơ sở hạ tầng (Infrastructure, Network)",SỞ GIAO DỊCH CHỨNG KHOÁN THÀNH PHỐ HỒ CHÍ MINH,Ho Chi Minh,"Networking, Database, Cloud",2025-10-18 02:28:54,https://itviec.com/it-jobs/chuyen-vien-co-so-ha-tang-infrastructure-network-so-giao-dich-chung-khoan-thanh-pho-ho-chi-minh-4250/content?job_index=13&locale=en&page=13,Network Engineer,At office,2025-10-25 03:01:43
"02 Vận hành và Kiểm thử phần mềm (Tester, QA AC)",SỞ GIAO DỊCH CHỨNG KHOÁN THÀNH PHỐ HỒ CHÍ MINH,Ho Chi Minh,"Tester, QA QC",2025-10-18 02:28:56,https://itviec.com/it-jobs/chuyen-vien-van-hanh-va-kiem-thu-phan-mem-02-nguoi-so-giao-dich-chung-khoan-thanh-pho-ho-chi-minh-4503/content?job_index=14&locale=en&page=13,Manual Tester,At office,2025-10-25 03:01:43
"Python Developer AI & ETL Engineer (LangChain, MongoDB)",Novumstate GmbH,Ha Noi,"Python, Database, MongoDB, LLM, Java, AI",2025-10-18 02:28:58,https://itviec.com/it-jobs/python-developer-ai-etl-engineer-langchain-mongodb-novumstate-gmbh-1630/content?job_index=15&locale=en&page=13,AI / Machine Learning Engineer,At office,2025-10-25 03:01:43
Senior Software Engineer (Java/TypeScript/English),Cloud Technology,Ho Chi Minh,"Java, ReactJS, TypeScript, Cloud, NodeJS, English",2025-10-18 02:28:59,https://itviec.com/it-jobs/senior-software-engineer-java-typescript-english-cloud-technology-5314/content?job_index=16&locale=en&page=13,Fullstack Developer,Hybrid (flexible between home and office),2025-10-25 03:01:43
"Chuyên Viên Phát Triển Ứng Dụng (Java, .NET, OOP)",Vietbank,Ho Chi Minh,"Java, HTML, Unit test, OOP, .NET, JavaScript",2025-10-18 02:29:01,https://itviec.com/it-jobs/chuyen-vien-phat-trien-ung-dung-java-net-oop-vietbank-2544/content?job_index=17&locale=en&page=13,Fullstack Developer,At office,2025-10-25 03:01:43
Techlead Python - Good at English communication,VMO Holdings,Ha Noi,"Python, NoSQL, Java, Django, English",2025-10-18 02:29:03,https://itviec.com/it-jobs/techlead-python-good-at-english-communication-vmo-holdings-1704/content?job_index=18&locale=en&page=13,Fullstack Developer,At office,2025-10-25 03:01:43
"UI/UX Designer (Figma, English)",Floware,Ho Chi Minh,"UI-UX, Design, English",2025-10-18 02:29:04,https://itviec.com/it-jobs/ui-ux-designer-figma-english-floware-3522/content?job_index=19&locale=en&page=13,UX/UI Designer,At office,2025-10-25 03:01:43
QA QC Engineer (Manual Tester),Floware,Ho Chi Minh,"Tester, Playwright, QA QC, English",2025-10-18 02:29:15,https://itviec.com/it-jobs/qa-qc-engineer-manual-tester-floware-3813/content?job_index=0&locale=en&page=14,Manual Tester,At office,2025-10-25 03:01:43
"Fresher & Junior - Software Developer (.NET, Java, C#)",Netcompany,Ho Chi Minh,".NET, English, Java, C#",2025-10-18 02:29:16,https://itviec.com/it-jobs/fresher-junior-software-developer-net-java-c-netcompany-1254/content?job_index=1&locale=en&page=14,Backend Developer,At office,2025-10-25 03:01:43
AI Machine Learning Engineer,Nexcel Solutions,Ho Chi Minh,"AI, Deep Learning, Machine Learning, Data Analysis, MLOps, Python",2025-10-18 02:29:18,https://itviec.com/it-jobs/ai-machine-learning-engineer-nexcel-solutions-5700/content?job_index=2&locale=en&page=14,AI / Machine Learning Engineer,At office,2025-10-25 03:01:43
IT Director (Japanese N2),"VAND Co., Ltd",Ho Chi Minh,"Japanese IT Communication, Project Management, Business Analysis, Tester, English, Japanese",2025-10-18 02:29:20,https://itviec.com/it-jobs/it-director-japanese-n2-vand-co-ltd-5756/content?job_index=3&locale=en&page=14,Manual Tester,Hybrid (flexible between home and office),2025-10-25 03:01:43
"Quality Control Engineer (QA/QC, Manual Tester)",YRGLM Việt Nam,Ho Chi Minh,"QA QC, BigCommerce, Ec-cube, API, SQL, Tester",2025-10-18 02:29:21,https://itviec.com/it-jobs/quality-control-engineer-qa-qc-manual-tester-yrglm-viet-nam-5538/content?job_index=4&locale=en&page=14,Manual Tester,At office,2025-10-25 03:01:43
Senior .NET Developer (C# - Desktop Application),Simpson Strong-Tie Vietnam,Ho Chi Minh,".NET, WinForms, WPF, C#, .Net Core, English",2025-10-18 02:29:23,https://itviec.com/it-jobs/senior-net-developer-c-desktop-application-simpson-strong-tie-vietnam-3024/content?job_index=5&locale=en&page=14,Backend Developer,Hybrid (flexible between home and office),2025-10-25 03:01:43
"Software Engineer C#, .Net, WPF",MiTek Viet Nam,Ho Chi Minh,".NET, WinForms, ReactJS, Angular, WPF, C#",2025-10-17 02:29:25,https://itviec.com/it-jobs/software-engineer-c-net-wpf-mitek-viet-nam-0349/content?job_index=6&locale=en&page=14,Fullstack Developer,"Tòa nhà A5, Lô số A5, khu E-Office, đường Sáng Tạo, KCX Tân Thuận, Phường Tân Thuận, District 7, Ho Chi Minh",2025-10-25 03:01:43
Data Engineer (C#/.NET/SQL),Trail Limited,Ha Noi,"C#, Azure, T-SQL, .NET, SQL, English",2025-10-17 02:29:26,https://itviec.com/it-jobs/data-engineer-c-net-sql-trail-limited-3004/content?job_index=7&locale=en&page=14,Data Engineer,At office,2025-10-25 03:01:43
"Senior Business Analyst (Agile/Scrum, Project Manager)",Ken Logistics,Ha Noi,"Business Analysis, Team Management, Product Owner, Project Management, Scrum, Agile",2025-10-17 02:29:28,https://itviec.com/it-jobs/senior-business-analyst-agile-scrum-ken-logistics-5439/content?job_index=8&locale=en&page=14,Business Analyst,At office,2025-10-25 03:01:43
Automation Quality Control (Domain Blockchain),GEM Corporation,Ha Noi - Ho Chi Minh,"Automation Test, JavaScript, Blockchain, Playwright, English",2025-10-17 02:29:30,https://itviec.com/it-jobs/automation-quality-control-domain-blockchain-gem-corporation-5940/content?job_index=9&locale=en&page=14,Automation Tester,At office,2025-10-25 03:01:43
BrSE/ Scrum Master/ Project Leader (Japanese speaking),Panasonic Vietnam Group – Panasonic R&D Center Vietnam (PRDCV),Ha Noi,"Bridge Engineer, Web API, Business Analysis, Japanese, Mobile Apps, Project Management",2025-10-17 02:29:31,https://itviec.com/it-jobs/brse-scrum-master-project-leader-japanese-speaking-panasonic-vietnam-group-panasonic-r-d-center-vietnam-prdcv-1738/content?job_index=10&locale=en&page=14,Bridge System Engineer (BrSE),At office,2025-10-25 03:01:43
"Lập trình chuyên về Mdware (Java,Spring,SQL Server)",VINX VIETNAM,Ho Chi Minh,"Java, CSS, HTML, JavaScript, Spring, SQL",2025-10-17 02:29:33,https://itviec.com/it-jobs/lap-trinh-chuyen-ve-mdware-java-spring-sql-server-vinx-vietnam-0745/content?job_index=11&locale=en&page=14,Backend Developer,At office,2025-10-25 03:01:43
FullStack Dev (NodeJS/ReactJS) - Signing Bonus UpTo 60M,FPT Software,Ha Noi,"Fullstack, ReactJS, AWS, NodeJS, NestJS, TypeScript",2025-10-17 02:29:35,https://itviec.com/it-jobs/fullstack-dev-nodejs-reactjs-signing-bonus-upto-60m-fpt-software-5030/content?job_index=12&locale=en&page=14,Fullstack Developer,At office,2025-10-25 03:01:43
Data Engineer (Python/ Cloud/ AWS/ SQL/ ETL),Zyneric,Ho Chi Minh,"Data Engineer, ELT, SQL, Python, AWS, Cloud",2025-10-17 02:29:36,https://itviec.com/it-jobs/data-engineer-python-cloud-aws-sql-etl-zyneric-1133/content?job_index=13&locale=en&page=14,Data Engineer,At office,2025-10-25 03:01:43
AI Engineer (Python/ Machine Learning),Zyneric,Ho Chi Minh,"AI, Unity, C#, Golang, Python, Machine Learning",2025-10-17 02:29:38,https://itviec.com/it-jobs/ai-engineer-python-machine-learning-zyneric-5811/content?job_index=14&locale=en&page=14,AI / Machine Learning Engineer,At office,2025-10-25 03:01:43
"Android Developer (Kotlin, Java)",TymeX,Ho Chi Minh,"Android, MVVM, Java, Mobile Apps, Kotlin, Agile",2025-10-17 02:29:40,https://itviec.com/it-jobs/android-developer-kotlin-java-tymex-2906/content?job_index=15&locale=en&page=14,Mobile Application Developer,Hybrid (flexible between home and office),2025-10-25 03:01:43
Fullstack Java Developer,"SOFTFLEX LLC CO.,LTD",Ha Noi,"Java, GCP, English, SQL, Microservices, ReactJS",2025-10-17 02:29:41,https://itviec.com/it-jobs/fullstack-java-developer-softflex-llc-co-ltd-2748/content?job_index=16&locale=en&page=14,Fullstack Developer,At office,2025-10-25 03:01:43
Full-Stack (Node.js) - More Than Just a Coder,Business4you AG,Ho Chi Minh,"English, DevOps, PHP, NodeJS",2025-10-17 02:29:43,https://itviec.com/it-jobs/full-stack-node-js-more-than-just-a-coder-business4you-ag-1737/content?job_index=17&locale=en&page=14,Fullstack Developer,At office,2025-10-25 03:01:43
iOS Developer (Middle/Senior Level),Vulcan Labs,Ho Chi Minh,"Swift, MVVM, CI/CD, iOS",2025-10-17 02:29:45,https://itviec.com/it-jobs/ios-developer-middle-senior-level-vulcan-labs-4553/content?job_index=18&locale=en&page=14,Mobile Application Developer,At office,2025-10-25 03:01:43
Data Scientist,Deliveree On-Demand Logistics,Ho Chi Minh,"Data Science, English, Python, SQL, Machine Learning",2025-10-17 02:29:46,https://itviec.com/it-jobs/data-scientist-deliveree-on-demand-logistics-0815/content?job_index=19&locale=en&page=14,Data Scientist,At office,2025-10-25 03:01:43
Full-Stack Developer,AURIFY,Ho Chi Minh,"Fullstack, English, CI/CD, Cypress, VueJS, Angular",2025-10-17 02:29:57,https://itviec.com/it-jobs/full-stack-developer-aurify-3808/content?job_index=0&locale=en&page=15,Fullstack Developer,Hybrid (flexible between home and office),2025-10-25 03:01:43
Senior Software Engineer ( Java),Renesas Design Vietnam,Ho Chi Minh,"Java, Elasticsearch, Redis, ReactJS, Cloud, NodeJS",2025-10-17 02:29:58,https://itviec.com/it-jobs/senior-software-engineer-java-renesas-design-vietnam-2601/content?job_index=1&locale=en&page=15,Backend Developer,Hybrid (flexible between home and office),2025-10-25 03:01:43
Senior Software Asset Management Specialist,Renesas Design Vietnam,Ho Chi Minh,"Data Analysis, System Admin, Database, IT Support, English",2025-10-17 02:30:00,https://itviec.com/it-jobs/senior-software-asset-management-specialist-renesas-design-vietnam-5510/content?job_index=2&locale=en&page=15,Data Analyst,Hybrid (flexible between home and office),2025-10-25 03:01:43
"BackEnd Engineer (NodeJS,NestJS,Python,AI) ~ 4000$",Homebase Vietnam,Ho Chi Minh,"NodeJS, NestJS, AI, SQL, Python, English",2025-10-17 02:30:02,https://itviec.com/it-jobs/sr-backend-engineer-nodejs-nestjs-python-ai-4000-homebase-vietnam-4034/content?job_index=3&locale=en&page=15,Backend Developer,At office,2025-10-25 03:01:43
Chuyên viên Quản lý Hạ tầng Trung tâm dữ liệu,MB Bank,Ha Noi,"Linux, Penetration Testing, Security, MySQL, SQL",2025-10-17 02:30:03,https://itviec.com/it-jobs/chuyen-vien-quan-ly-ha-tang-trung-tam-du-lieu-mb-bank-4821/content?job_index=4&locale=en&page=15,Systems Engineer / Administrator,At office,2025-10-25 03:01:43
Bridge System Engineer (Java/AI Background),Agentec Vietnam,Ho Chi Minh,"Bridge Engineer, NextJS, Japanese, AI, AWS, Java",2025-10-16 02:30:05,https://itviec.com/it-jobs/bridge-system-engineer-java-ai-background-agentec-vietnam-5918/content?job_index=5&locale=en&page=15,Bridge System Engineer (BrSE),At office,2025-10-25 03:01:43
DevOps Engineer,The Rep. Office of STYL Solutions Pte. Ltd. In HCMC,Ho Chi Minh,"DevOps, Docker, AWS",2025-10-16 02:30:07,https://itviec.com/it-jobs/devops-engineer-the-rep-office-of-styl-solutions-pte-ltd-in-hcmc-0103/content?job_index=6&locale=en&page=15,DevOps Engineer,Hybrid (flexible between home and office),2025-10-25 03:01:43
Automation Tester (Python) (Junior/Middle),PAL TECH,Ho Chi Minh,"Automation Test, API, CI/CD, Python",2025-10-16 02:30:08,https://itviec.com/it-jobs/automation-tester-python-junior-middle-pal-tech-1052/content?job_index=7&locale=en&page=15,Automation Tester,At office,2025-10-25 03:01:43
"Senior/Lead AI Engineer (Python, Machine Learning)",Bosch Global Software Technologies Company Limited,Ho Chi Minh,"Machine Learning, Generative AI, LLM, Python, Deep Learning, AI",2025-10-16 02:30:10,https://itviec.com/it-jobs/senior-lead-ai-engineer-python-machine-learning-bosch-global-software-technologies-company-limited-5604/content?job_index=8&locale=en&page=15,AI / Machine Learning Engineer,At office,2025-10-25 03:01:43
"Web Designer (UI-UX, Figma) - Japanese Company","Abilive Vietnam Co., Ltd.",Ha Noi,"Design, Japanese, UI-UX, Wordpress, CSS, HTML5",2025-10-16 02:30:12,https://itviec.com/it-jobs/web-designer-ui-ux-figma-japanese-company-abilive-vietnam-co-ltd-2212/content?job_index=9&locale=en&page=15,UX/UI Designer,At office,2025-10-25 03:01:43
"Web Developer (JavaScript, ReactJS, TypeScript)",Medigo,Ho Chi Minh,"JavaScript, Agile, CSS, TypeScript, NextJS, ReactJS",2025-10-16 02:30:13,https://itviec.com/it-jobs/web-developer-medigo-4600/content?job_index=10&locale=en&page=15,Frontend Developer,At office,2025-10-25 03:01:43
Senior/Principal QA Automation Engineer (Playwright),Aperia Solutions Vietnam Co Ltd,Ho Chi Minh - Da Nang,"Automation Test, Playwright, Selenium, Jmeter, TypeScript, Azure",2025-10-16 02:30:15,https://itviec.com/it-jobs/senior-principal-qa-automation-engineer-playwright-aperia-solutions-vietnam-co-ltd-3952/content?job_index=11&locale=en&page=15,Automation Tester,At office,2025-10-25 03:01:43
Chuyên viên Rủi ro An toàn thông tin - IT Risk,MB Bank,Ha Noi,"Risk Management, ServiceNow, Pentest, PCI DSS, Risk Assessment / BCP",2025-10-16 02:30:17,https://itviec.com/it-jobs/chuyen-vien-rui-ro-an-toan-thong-tin-it-risk-mb-bank-0102/content?job_index=12&locale=en&page=15,IT Auditor / IT Risk Manager,At office,2025-10-25 03:01:43
Senior Security Operations Engineer,AURIFY,Ho Chi Minh,"Security, Docker, SOAR, SIEM, Linux, English",2025-10-16 02:30:18,https://itviec.com/it-jobs/senior-security-operations-engineer-aurify-3624/content?job_index=13&locale=en&page=15,Security Engineer,Hybrid (flexible between home and office),2025-10-25 03:01:43
"Product Manager/Product Owner (SaaS, AI, Data domain)",The Stakeholder Company (TSC.ai),Ho Chi Minh,"Product Management, Product roadmap, Product Metrics, Product Owner, AI, English",2025-10-16 02:30:20,https://itviec.com/it-jobs/product-manager-product-owner-saas-ai-data-domain-the-stakeholder-company-tsc-ai-3710/content?job_index=14&locale=en&page=15,Product Manager,Hybrid (flexible between home and office),2025-10-25 03:01:43
"CV Vận hành ứng dụng/ T24 Core Dev (Java, .NET, Python)",Sacombank,Ho Chi Minh,"Java, SQL, Oracle, JavaScript, Python, .NET",2025-10-15 02:30:22,https://itviec.com/it-jobs/cv-van-hanh-ung-dung-t24-core-dev-java-net-python-sacombank-2527/content?job_index=15&locale=en&page=15,Fullstack Developer,At office,2025-10-25 03:01:43
QA Engineer (Manual & Automation Tester),HDS Services Vietnam,Ho Chi Minh,"QA QC, English, API, SQL, Automation Test, Tester",2025-10-15 02:30:23,https://itviec.com/it-jobs/qa-engineer-manual-automation-hds-services-vietnam-0056/content?job_index=16&locale=en&page=15,Test Coordinator / QAQC Coordinator,At office,2025-10-25 03:01:43
Frontend developer (ReactJS/NextJS),SSI Securities Corporation,Ha Noi,"ReactJS, JavaScript, NextJS",2025-10-15 02:30:25,https://itviec.com/it-jobs/frontend-developer-reactjs-nextjs-ssi-securities-corporation-5938/content?job_index=17&locale=en&page=15,Frontend Developer,At office,2025-10-25 03:01:43
Mobile Developer (Flutter),SSI Securities Corporation,Ha Noi,"Flutter, Mobile Apps",2025-10-15 02:30:27,https://itviec.com/it-jobs/mobile-developer-flutter-ssi-securities-corporation-5334/content?job_index=18&locale=en&page=15,Mobile Application Developer,At office,2025-10-25 03:01:43
Senior Full Stack Developer (Frontend Focus),VNGGames,Ho Chi Minh,"JavaScript, ReactJS, TypeScript, Fullstack, CSS",2025-10-15 02:30:28,https://itviec.com/it-jobs/senior-full-stack-developer-frontend-focus-vnggames-0621/content?job_index=19&locale=en&page=15,Fullstack Developer,At office,2025-10-25 03:01:43
"Junior AI Agent Engineer (n8n Core, NodeJS, Python)",MediaX,Ha Noi,"AI, LLM, API, Python, NodeJS",2025-10-15 02:30:39,https://itviec.com/it-jobs/junior-ai-agent-engineer-n8n-core-nodejs-python-mediax-1535/content?job_index=0&locale=en&page=16,AI / Machine Learning Engineer,At office,2025-10-25 03:01:43
"Fullstack Developer (.Net,C#,SQL)","CJ OLIVENETWORKS VINA CO., LTD",Ho Chi Minh,".NET, Microsoft SQL Server, SQL, vb.net, ASP.NET, C#",2025-10-15 02:30:40,https://itviec.com/it-jobs/fullstack-developer-net-c-sql-cj-olivenetworks-vina-co-ltd-2647/content?job_index=1&locale=en&page=16,Fullstack Developer,At office,2025-10-25 03:01:43
Backend Developer (Golang),Bankaool,Ho Chi Minh,"Golang, Gin, Apache HttpClient, Git, AWS",2025-10-15 02:30:42,https://itviec.com/it-jobs/backend-developer-golang-bankaool-3003/content?job_index=2&locale=en&page=16,Backend Developer,At office,2025-10-25 03:01:43
"Mobile Architect (React Native, Good English)",KMS Technology,Ho Chi Minh - Da Nang,"React Native, JavaScript, Redux, Android, iOS, Mobile Apps",2025-10-15 02:30:44,https://itviec.com/it-jobs/mobile-architect-react-native-good-english-kms-technology-2730/content?job_index=3&locale=en&page=16,Mobile Application Developer,Hybrid (flexible between home and office),2025-10-25 03:01:43
"Fullstack Developer (Golang, NodeJS, ReactJS, Java)~35M",OpenCommerce Group,Ha Noi,"Golang, ReactJS, Java, Python, VueJS, NodeJS",2025-10-15 02:30:45,https://itviec.com/it-jobs/fullstack-developer-golang-nodejs-reactjs-java-35m-opencommerce-group-4459/content?job_index=4&locale=en&page=16,Fullstack Developer,At office,2025-10-25 03:01:43
"Backend Developer (NodeJS, Goalng, Python, API, MySQL)",Unity Sport JSC,Ho Chi Minh,"NodeJS, MySQL, Kubernetes, API, Python, Golang",2025-10-15 02:30:47,https://itviec.com/it-jobs/backend-developer-nodejs-goalng-python-api-mysql-unity-sport-jsc-1052/content?job_index=5&locale=en&page=16,Backend Developer,At office,2025-10-25 03:01:43
Python Developer,NGS,Ha Noi,"Python, HTML, API, Apache HttpClient, Linux, SQL",2025-10-15 02:30:49,https://itviec.com/it-jobs/python-developer-ngs-1235/content?job_index=6&locale=en&page=16,Backend Developer,At office,2025-10-25 03:01:43
Manual QA (E-Commerce Site Projects),Breadstack Technologies Inc,Ha Noi - Ho Chi Minh,"Tester, Magento, Shopify, WooCommerce, Wordpress",2025-10-15 02:30:50,https://itviec.com/it-jobs/manual-qa-e-commerce-site-projects-breadstack-technologies-inc-4813/content?job_index=7&locale=en&page=16,Manual Tester,"Work remotely, Other, Ho Chi Minh",2025-10-25 03:01:43
"Remote Senior Fullstack Engineer (Go, ReactJS)",Fram,Ho Chi Minh,"Golang, AWS, Fullstack, ReactJS, English",2025-10-15 02:30:52,https://itviec.com/it-jobs/remote-senior-fullstack-engineer-go-reactjs-fram-2342/content?job_index=8&locale=en&page=16,Fullstack Developer,Remote (don't have to come to the office),2025-10-25 03:01:43
