job_title,company_name,location,skills_required,date_posted,job_link,job_category,work_mode,crawl_date
"Backend Golang Developer (Gin/Echo, PostgreSQL, Redis)",Vietnix,Ho Chi Minh,"Golang, Git, Redis, PostgreSql, API, Gin",2025-09-30 08:33:01,https://itviec.com/it-jobs/backend-golang-developer-gin-echo-postgresql-redis-vietnix-1829/content?job_index=2&locale=en&page=40,Backend Developer,At office,2025-10-21 08:45:56
Middle/Senior UI/UX Designer (English),"CJ OLIVENETWORKS VINA CO., LTD",Ho Chi Minh,"UI-UX, Sketch, Figma, Adobe, English",2025-09-30 08:33:02,https://itviec.com/it-jobs/middle-senior-ui-ux-designer-english-cj-olivenetworks-vina-co-ltd-2036/content?job_index=3&locale=en&page=40,UX/UI Designer,At office,2025-10-21 08:45:56
"Python Technical Lead (Cloud, FastAPI, Django)",VSOL,Ho Chi Minh - Ha Noi,"Python, FastAPI, PostgreSql, Cloud, DevOps, Django",2025-09-30 08:33:04,https://itviec.com/it-jobs/python-technical-lead-cloud-fastapi-django-vsol-5634/content?job_index=4&locale=en&page=40,Software/Technical Architect,At office,2025-10-21 08:45:56
"Embedded Linux Engineer (C++, Linux)",Datalogic Việt Nam,Ho Chi Minh,"C++, Linux, Embedded",2025-09-30 08:33:06,https://itviec.com/it-jobs/embedded-linux-engineer-c-linux-datalogic-viet-nam-4030/content?job_index=5&locale=en&page=40,Embedded Engineer,At office,2025-10-21 08:45:56
VTS - Project Manager (Agile/ Azure/ AWS),Viettel Group,Ha Noi,"Project Management, AWS, Azure, Agile",2025-09-30 08:33:07,https://itviec.com/it-jobs/vts-project-manager-agile-azure-aws-viettel-group-3936/content?job_index=6&locale=en&page=40,Project Manager,At office,2025-10-21 08:45:56
"Senior/Principal Developer (C#, .Net, ERP, ReactJS)",LINH LONG ELECTRONIC ENGINEERING,Ho Chi Minh,"C#, ERP, Azure, ReactJS, English, .NET",2025-09-30 08:33:09,https://itviec.com/it-jobs/senior-principal-developer-c-net-erp-reactjs-linh-long-electronic-engineering-1319/content?job_index=7&locale=en&page=40,Fullstack Developer,Hybrid (flexible between home and office),2025-10-21 08:45:56
".NET Technical Lead (.NET Core, C#, Azure)",VSOL,Ho Chi Minh - Ha Noi,".NET, C#, .Net Core, MVC, Azure, AWS",2025-09-30 08:33:11,https://itviec.com/it-jobs/net-technical-lead-net-core-c-azure-vsol-3713/content?job_index=8&locale=en&page=40,Software/Technical Architect,At office,2025-10-21 08:45:56
"Backend Developer (Java,Kotlin, OOP, SQL, Spring, Git)",DGW Asia,Da Nang,"Java, Spring Boot, OOP, Kotlin, Spring, SQL",2025-09-30 08:33:12,https://itviec.com/it-jobs/backend-developer-java-kotlin-oop-sql-spring-git-dgw-asia-3013/content?job_index=9&locale=en&page=40,Backend Developer,At office,2025-10-21 08:45:56
"Internal Developer Platform Engineer (DevOps. NET, C#)",MiTek Viet Nam,Ho Chi Minh,"DevOps, Azure, Microservices, .NET, C#, IoT Platforms",2025-09-30 08:33:14,https://itviec.com/it-jobs/internal-developer-platform-engineer-devops-net-c-mitek-viet-nam-5243/content?job_index=10&locale=en&page=40,DevOps Engineer,"Tòa nhà A5, Lô số A5, khu E-Office, đường Sáng Tạo, KCX Tân Thuận, Phường Tân Thuận, District 7, Ho Chi Minh",2025-10-21 08:45:56
Middle/Senior Python Developer,Saigon Technology,Ho Chi Minh,"Python, AWS, Django, English, VueJS, ReactJS",2025-09-30 08:33:16,https://itviec.com/it-jobs/middle-senior-python-developer-saigon-technology-4653/content?job_index=11&locale=en&page=40,Backend Developer,Hybrid (flexible between home and office),2025-10-21 08:45:56
"Bridge System Engineer (Web/Mobile BrSE, full-remote)",Brycen Vietnam,Others - Da Nang - Ho Chi Minh,"Bridge Engineer, AI, C#, Japanese, Java, Mobile Apps",2025-09-29 08:33:18,https://itviec.com/it-jobs/bridge-system-engineer-web-mobile-brse-full-remote-brycen-vietnam-5536/content?job_index=12&locale=en&page=40,Bridge System Engineer (BrSE),Remote (don't have to come to the office),2025-10-21 08:45:56
Senior Software Engineer (Web/Mobile App),Brycen Vietnam,Others - Ho Chi Minh - Da Nang,"Software Architecture, MySQL, .NET, Spring Boot, Java, Fullstack",2025-09-29 08:33:19,https://itviec.com/it-jobs/senior-engineer-web-mobile-app-brycen-vietnam-5318/content?job_index=13&locale=en&page=40,Fullstack Developer,Hybrid (flexible between home and office),2025-10-21 08:45:56
"Data Engineer (SQL, Agile)",Live Payments,Ho Chi Minh,"SQL, ETL, Big Data, Business Intelligence, AWS, English",2025-09-29 08:33:21,https://itviec.com/it-jobs/data-engineer-sql-agile-live-payments-2546/content?job_index=14&locale=en&page=40,Data Engineer,At office,2025-10-21 08:45:56
System Engineer (Linux/VMware) Banking Infrastructure,SHINHAN DS,Ho Chi Minh,"Linux, Hardware Troubleshooting, VMware, Bash Shell, System Admin, Python",2025-09-29 08:33:23,https://itviec.com/it-jobs/system-engineer-linux-vmware-banking-infrastructure-shinhan-ds-0844/content?job_index=15&locale=en&page=40,Systems Engineer / Administrator,At office,2025-10-21 08:45:56
"Software Engineer (Python, JavaScript, Java)",WAVENET VIỆT NAM,Ho Chi Minh,"Python, Java, JavaScript",2025-09-29 08:33:24,https://itviec.com/it-jobs/software-engineer-python-javascript-java-wavenet-viet-nam-5454/content?job_index=16&locale=en&page=40,Fullstack Developer,At office,2025-10-21 08:45:56
GPBank_Java Developer_Level Middle/Senior/Expert_Core,NGÂN HÀNG THƯƠNG MẠI TNHH MTV KỶ NGUYÊN THỊNH VƯỢNG (GPBANK),Ha Noi,"JavaScript, Docker, GitLab CI, Microservices, Entity Framework Core, AWS",2025-09-29 08:33:26,https://itviec.com/it-jobs/gpbank_java-developer_level-middle-senior-expert_core-gpbank-3225/content?job_index=17&locale=en&page=40,Banking & Financial Systems Developer,At office,2025-10-21 08:45:56
Manual QA/QC Engineer,Smilegate Vietnam,Ho Chi Minh,"QA QC, Usability testing, White box testing, Black box testing, A/B testing, Tester",2025-09-29 08:33:28,https://itviec.com/it-jobs/manual-qa-qc-engineer-smilegate-vietnam-5504/content?job_index=18&locale=en&page=40,Manual Tester,At office,2025-10-21 08:45:56
"Senior Frontend Developer (VueJS, ReactJS, Angular)",Ahasoft,Ho Chi Minh,"VueJS, Angular, .NET, AI, TypeScript, ReactJS",2025-09-29 08:33:29,https://itviec.com/it-jobs/senior-frontend-developer-vuejs-reactjs-angular-ahasoft-3923/content?job_index=19&locale=en&page=40,Frontend Developer,At office,2025-10-21 08:45:56
Senior Python Full-stack Developer,Hitachi Digital Services,Ho Chi Minh - Da Nang - Ha Noi,"Python, ReactJS, CSS, HTML, Cloud, AWS",2025-09-29 08:33:40,https://itviec.com/it-jobs/senior-python-full-stack-developer-hitachi-digital-services-1326/content?job_index=0&locale=en&page=41,Fullstack Developer,Hybrid (flexible between home and office),2025-10-21 08:45:56
Junior/Fresher Front-end Dev (JavaScript/ ReactJS/ CSS),CÔNG TY TNHH OVEN,Ho Chi Minh,"JavaScript, CSS, Angular, HTML, English, ReactJS",2025-09-29 08:33:41,https://itviec.com/it-jobs/junior-fresher-front-end-developer-javascript-reactjs-cong-ty-tnhh-oven-3330/content?job_index=1&locale=en&page=41,Frontend Developer,At office,2025-10-21 08:45:56
Junior/Fresher Back-end Dev ( JavaScript/ NodeJS/ OOP),CÔNG TY TNHH OVEN,Ho Chi Minh,"NodeJS, NestJS, ExpressJS, OOP, English, PHP",2025-09-29 08:33:43,https://itviec.com/it-jobs/junior-fresher-back-end-developer-javascript-nodejs-cong-ty-tnhh-oven-3736/content?job_index=2&locale=en&page=41,Backend Developer,At office,2025-10-21 08:45:56
"QA Tester (Manual Tester, QA QC, Automation Test)",ElectHQ,Ho Chi Minh,"QA QC, Automation Test, Tester",2025-09-29 08:33:45,https://itviec.com/it-jobs/qa-tester-manual-tester-qa-qc-automation-test-electhq-5605/content?job_index=3&locale=en&page=41,Automation Tester,At office,2025-10-21 08:45:56
"Senior FullStack Developer (NodeJS + ReactJS, AI/ML)",ElectHQ,Ho Chi Minh,"Fullstack, NodeJS, ReactJS, Database, Machine Learning, AI",2025-09-29 08:33:46,https://itviec.com/it-jobs/senior-fullstack-developer-nodejs-reactjs-ai-ml-electhq-0316/content?job_index=4&locale=en&page=41,Fullstack Developer,Hybrid (flexible between home and office),2025-10-21 08:45:56
Java Developer (1 - Month - Signing Bonus),SoftRoad Việt Nam,Ha Noi,"Java, Spring Boot, DevOps, Oracle, J2EE",2025-09-29 08:33:48,https://itviec.com/it-jobs/java-developer-1-month-signing-bonus-softroad-viet-nam-2726/content?job_index=5&locale=en&page=41,Backend Developer,At office,2025-10-21 08:45:56
QA/Tester,Rexy Technology,Ho Chi Minh,"Tester, Automation Test",2025-09-29 08:33:50,https://itviec.com/it-jobs/qa-tester-rexy-technology-0635/content?job_index=6&locale=en&page=41,Test Coordinator / QAQC Coordinator,At office,2025-10-21 08:45:56
"Junior/Fresher Manual Tester (Automation Test, QA QC)",Cty TNHH TM và DV Tin Học Phần Mềm Vàng,Ho Chi Minh,"Tester, Postman, Jira, API, Automation Test, QA QC",2025-09-29 08:33:51,https://itviec.com/it-jobs/junior-fresher-manual-tester-automation-test-qa-qc-cty-tnhh-tm-va-dv-tin-hoc-phan-mem-vang-4004/content?job_index=7&locale=en&page=41,Manual Tester,At office,2025-10-21 08:45:56
Product Manager (Project Manager / Product Owner),MiTek Viet Nam,Ho Chi Minh,"Product Management, Product Owner, Business Analysis, Project Management, Agile, English",2025-09-29 08:33:53,https://itviec.com/it-jobs/product-manager-project-manager-product-owner-mitek-viet-nam-1919/content?job_index=8&locale=en&page=41,Product Manager,"Tòa nhà A5, Lô số A5, khu E-Office, đường Sáng Tạo, KCX Tân Thuận, Phường Tân Thuận, District 7, Ho Chi Minh",2025-10-21 08:45:56
"Middle/Senior Software Developer (C#, .Net, SQL)",MiTek Viet Nam,Ho Chi Minh,".NET, WinForms, C#, Azure, SQL, English",2025-09-29 08:33:55,https://itviec.com/it-jobs/middle-senior-software-developer-c-net-sql-mitek-viet-nam-0908/content?job_index=9&locale=en&page=41,Fullstack Developer,"Tòa nhà A5, Lô số A5, khu E-Office, đường Sáng Tạo, KCX Tân Thuận, Phường Tân Thuận, District 7, Ho Chi Minh",2025-10-21 08:45:56
Android Dev Mobile App (Java/Kotlin),TOHSoft,Ha Noi,"Android, English, Software Architecture, SQL, Java, Kotlin",2025-09-29 08:33:56,https://itviec.com/it-jobs/android-dev-mobile-app-java-kotlin-tohsoft-5801/content?job_index=10&locale=en&page=41,Mobile Application Developer,At office,2025-10-21 08:45:56
Technical Project Manager (English),Terralogic,Ho Chi Minh,"Project Management, Product Management, Cloud, English, .NET, Software Architecture",2025-09-29 08:33:58,https://itviec.com/it-jobs/technical-project-manager-english-terralogic-0936/content?job_index=11&locale=en&page=41,Software/Technical Architect,At office,2025-10-21 08:45:56
Mid Frontend Developer (ReactJS),Fullerton Health,Ho Chi Minh,"ReactJS, TypeScript, JavaScript",2025-09-29 08:34:00,https://itviec.com/it-jobs/mid-frontend-developer-reactjs-fullerton-health-0457/content?job_index=12&locale=en&page=41,Frontend Developer,At office,2025-10-21 08:45:56
Testing Software Supervisor,Datalogic Việt Nam,Ho Chi Minh,"Team Management, TestComplete, Robot Framework, Leadership, Automation Test, Android",2025-09-29 08:34:01,https://itviec.com/it-jobs/testing-software-supervisor-datalogic-viet-nam-0258/content?job_index=13&locale=en&page=41,Automation Tester,At office,2025-10-21 08:45:56
"Senior Quality Engineer (Automation Tester, QA QC)",Sun Life Vietnam Insurance Company Limited,Ho Chi Minh,"Automation Test, Tester, QA QC, DevOps, Python, Java",2025-09-29 08:34:03,https://itviec.com/it-jobs/senior-quality-engineer-automation-tester-qa-qc-sun-life-vietnam-insurance-company-limited-0023/content?job_index=14&locale=en&page=41,Automation Tester,At office,2025-10-21 08:45:56
"Senior Automation Tester (Playwright, Selenium, QA QC)",ekino Vietnam,Ho Chi Minh,"Tester, QA QC, Automation Test, Selenium, Playwright, Java",2025-09-29 08:34:05,https://itviec.com/it-jobs/senior-automation-tester-playwright-selenium-qa-qc-ekino-vietnam-0022/content?job_index=15&locale=en&page=41,Automation Tester,At office,2025-10-21 08:45:56
CVCC vận hành ứng dụng (T24/Smartvista/ESB/API/Omni ),ABBANK,Ha Noi,"System Admin, Java, API, SQL, PHP, .NET",2025-09-29 08:34:06,https://itviec.com/it-jobs/cvcc-van-hanh-ung-dung-t24-smartvista-esb-api-omni-abbank-4356/content?job_index=16&locale=en&page=41,Banking & Financial Systems Developer,At office,2025-10-21 08:45:56
Magento Developer,Forix,Ho Chi Minh,"Magento, PHP",2025-09-28 08:34:08,https://itviec.com/it-jobs/magento-developer-forix-0725/content?job_index=17&locale=en&page=41,Backend Developer,At office,2025-10-21 08:45:56
"Python Developer (Django, MySQL, Rest API, Git)",CÔNG TY TNHH CÔNG NGHỆ SẠCH GREEN BIO,Ho Chi Minh,"Python, Git, MongoDB, API, MySQL, Django",2025-09-28 08:34:10,https://itviec.com/it-jobs/python-developer-django-mysql-rest-api-git-cong-ty-tnhh-cong-nghe-sach-green-bio-2533/content?job_index=18&locale=en&page=41,Backend Developer,At office,2025-10-21 08:45:56
"Game Client Developer (Cocos Creator, Unity)",CÔNG TY CỔ PHẦN SMARTSCALE,Ha Noi,"Games, TypeScript, JavaScript, Unity, Cocos Creator",2025-09-27 08:34:11,https://itviec.com/it-jobs/game-client-developer-cocos-creator-unity-cong-ty-co-phan-smartscale-4536/content?job_index=19&locale=en&page=41,Game Developer,At office,2025-10-21 08:45:56
"Game Client Developer (Cocos Creator, Unity)",CÔNG TY CỔ PHẦN SMARTSCALE,Ha Noi,"Games, TypeScript, JavaScript, Unity, Cocos Creator",2025-09-27 08:34:22,https://itviec.com/it-jobs/game-client-developer-cocos-creator-unity-cong-ty-co-phan-smartscale-4536/content?job_index=0&locale=en&page=42,Game Developer,At office,2025-10-21 08:45:56
[Ho Chi Minh] Full-Stack Developer (ReactJS/ NodeJS),ONE Tech Stop Vietnam Company Ltd,Ho Chi Minh,"NodeJS, HTML, SQL, NextJS, ReactJS, TypeScript",2025-09-27 08:34:23,https://itviec.com/it-jobs/ho-chi-minh-full-stack-developer-reactjs-nodejs-one-tech-stop-vietnam-company-ltd-3512/content?job_index=1&locale=en&page=42,Fullstack Developer,At office,2025-10-21 08:45:56
"DevOps Engineer (Oracle, MongoDB)",CÔNG TY CỔ PHẦN JARVIS GLOBAL,Ha Noi,"DevOps, Jenkins, MariaDB, MongoDB, Oracle",2025-09-27 08:34:25,https://itviec.com/it-jobs/devops-engineer-oracle-mongodb-cong-ty-co-phan-jarvis-global-1155/content?job_index=2&locale=en&page=42,DevOps Engineer,At office,2025-10-21 08:45:56
"Technical Lead (NextJS, TypeScript, Agile/Scrum, JS)",Công ty TNHH Ignisoft,Da Nang,"NextJS, JavaScript, Scrum, Agile, Leadership, TypeScript",2025-09-27 08:34:27,https://itviec.com/it-jobs/technical-lead-nextjs-typescript-agile-scrum-js-cong-ty-tnhh-ignisoft-4624/content?job_index=3&locale=en&page=42,Fullstack Developer,At office,2025-10-21 08:45:56
"Odoo Developer (Python, PostgreSQL, CI/CD, Git, XML)",EON TECH,Ho Chi Minh,"Odoo, XML, Git, CI/CD, PostgreSql, Python",2025-09-27 08:34:28,https://itviec.com/it-jobs/odoo-developer-python-postgresql-ci-cd-git-xml-eon-tech-2752/content?job_index=4&locale=en&page=42,Backend Developer,At office,2025-10-21 08:45:56
DevSecOps Engineer - Upto 3000$,Công ty TNHH Pod Foods Việt Nam,Ha Noi,"DevOps, API, Security, AWS, Cloud",2025-09-27 08:34:30,https://itviec.com/it-jobs/devsecops-engineer-upto-3000-cong-ty-tnhh-pod-foods-viet-nam-0209/content?job_index=5&locale=en&page=42,Backend Developer,At office,2025-10-21 08:45:56
[DaNang] Project Manager,TAKA TECHNOLOGY,Da Nang,"Project Management, iOS, Android, Leadership, English, Team Management",2025-09-27 08:34:32,https://itviec.com/it-jobs/danang-project-manager-taka-technology-5259/content?job_index=6&locale=en&page=42,Project Manager,At office,2025-10-21 08:45:56
[DaNang] Android Developer (Java/Kotlin),TAKA TECHNOLOGY,Da Nang,"Android, Git, MVVM, MVP, Kotlin, Java",2025-09-27 08:34:33,https://itviec.com/it-jobs/danang-android-developer-java-kotlin-taka-technology-4436/content?job_index=7&locale=en&page=42,Mobile Application Developer,At office,2025-10-21 08:45:56
Junior Fullstack Developers,CRM Integration,Ha Noi,"JavaScript, Java, UML, React Native, NodeJS",2025-09-27 08:34:35,https://itviec.com/it-jobs/junior-fullstack-developers-crm-integration-1254/content?job_index=8&locale=en&page=42,Fullstack Developer,At office,2025-10-21 08:45:56
Manual Software Test Lead (QA QC),Rakus Vietnam Company,Ho Chi Minh,"QA QC, Integration test, Tester, Team Management",2025-09-27 08:34:37,https://itviec.com/it-jobs/manual-software-test-lead-qa-qc-rakus-vietnam-company-1958/content?job_index=9&locale=en&page=42,Manual Tester,At office,2025-10-21 08:45:56
Software Developer (HTML/ CSS/ MySQL/ OOP),ATT Việt Nam,Ha Noi,"HTML, Laravel, MySQL, OOP, Git, CSS",2025-09-27 08:34:38,https://itviec.com/it-jobs/software-developer-html-css-mysql-oop-att-viet-nam-5638/content?job_index=10&locale=en&page=42,Fullstack Developer,At office,2025-10-21 08:45:56
Mobile Developer (Flutter/ Dart),FLASH BOX Photobooth Vietnam,Ho Chi Minh,"Flutter, Android, iOS, Firebase, AWS, Dart",2025-09-27 08:34:40,https://itviec.com/it-jobs/mobile-developer-flutter-dart-flash-box-photobooth-vietnam-0259/content?job_index=11&locale=en&page=42,Mobile Application Developer,At office,2025-10-21 08:45:56
"Sr JavaScript Dev - SaaS LMS (NodeJS, ReactJS, VueJS)",Công ty cổ phần công nghệ SpinGo,Ha Noi,"JavaScript, NodeJS, NoSQL, ReactJS, Python, Java",2025-09-27 08:34:42,https://itviec.com/it-jobs/senior-software-developer-saas-lms-nodejs-java-cong-ty-co-phan-cong-nghe-spingo-1114/content?job_index=12&locale=en&page=42,Fullstack Developer,At office,2025-10-21 08:45:56
Technical Leader - SaaS LMS (MERN/JAM stack),Công ty cổ phần công nghệ SpinGo,Ha Noi,"Java, Cloud, Database, Python, NodeJS, Leadership",2025-09-27 08:34:43,https://itviec.com/it-jobs/technical-leader-saas-lms-mern-jam-stack-cong-ty-co-phan-cong-nghe-spingo-0345/content?job_index=13&locale=en&page=42,Software/Technical Architect,At office,2025-10-21 08:45:56
"Senior Software Developer (ReactJS, NodeJS, JavaScript)",Thoughtworks Vietnam,Ho Chi Minh,"ReactJS, JavaScript, English, AWS, NodeJS",2025-09-27 08:34:45,https://itviec.com/it-jobs/senior-software-developer-reactjs-nodejs-javascript-thoughtworks-vietnam-0438/content?job_index=14&locale=en&page=42,Fullstack Developer,Hybrid (flexible between home and office),2025-10-21 08:45:56
"Frontend Developer ( NextJS, ReactJS, TyperScript)",YRISM VN,Ho Chi Minh,"ReactJS, Tailwind, TypeScript, HTML5",2025-09-27 08:34:47,https://itviec.com/it-jobs/frontend-developer-nextjs-reactjs-typerscript-yrism-vn-1216/content?job_index=15&locale=en&page=42,Frontend Developer,At office,2025-10-21 08:45:56
"Product Owner (Blockchain, Web3, Crypto, Agile)",FIZEN,Ha Noi,"Product Owner, Scrum, Agile, Cryptocurrency, Web3.js, Blockchain",2025-09-27 08:34:48,https://itviec.com/it-jobs/product-owner-blockchain-web3-crypto-agile-fizen-1434/content?job_index=16&locale=en&page=42,Product Owner,At office,2025-10-21 08:45:56
Automation Tester & Manual Tester (QA QC),OnePay,Ha Noi,"Tester, Automation Test, API, Jmeter, Postman, QA QC",2025-09-27 08:34:50,https://itviec.com/it-jobs/automation-tester-manual-tester-qa-qc-onepay-0734/content?job_index=17&locale=en&page=42,Software Engineer in Test (SDET),At office,2025-10-21 08:45:56
"Senior Frontend Developer (ReactJS, NextJS, English)",ekino Vietnam,Ho Chi Minh,"ReactJS, Redux, TypeScript, JavaScript, NextJS, English",2025-09-27 08:34:52,https://itviec.com/it-jobs/senior-frontend-developer-reactjs-nextjs-english-ekino-vietnam-4233/content?job_index=18&locale=en&page=42,Frontend Developer,At office,2025-10-21 08:45:56
"Senior QC Engineer/ SDET (QA QC, Automation Test)",M_Service (MoMo),Ho Chi Minh - Da Nang,"QA QC, Automation Test, Tester",2025-09-27 08:34:53,https://itviec.com/it-jobs/senior-qc-engineer-sdet-qa-qc-automation-test-m_service-momo-4026/content?job_index=19&locale=en&page=42,Manual Tester,At office,2025-10-21 08:45:56
[DI9] IT Business Analyst (Agile/Scrum) - MSB - 4M001,MSB,Ha Noi,"Business Analysis, Scrum, Agile, MySQL, Oracle, Database",2025-09-27 08:35:04,https://itviec.com/it-jobs/di9-it-business-analyst-agile-scrum-msb-4m001-msb-1241/content?job_index=0&locale=en&page=43,Business Analyst,At office,2025-10-21 08:45:56
"Backend Engineer (Golang, English, Product)",COGNISIAN,Ho Chi Minh,"Golang, English, NoSQL, Cloud, SQL, Database",2025-09-27 08:35:05,https://itviec.com/it-jobs/backend-engineer-golang-english-product-cognisian-3201/content?job_index=1&locale=en&page=43,Backend Developer,Hybrid (flexible between home and office),2025-10-21 08:45:56
Game Front-End Developer,CÔNG TY CỔ PHẦN SUNTEK,Ho Chi Minh,"Cocos, Games, CSS, TypeScript, JavaScript, HTML5",2025-09-26 08:35:07,https://itviec.com/it-jobs/game-front-end-developer-cong-ty-co-phan-suntek-2346/content?job_index=2&locale=en&page=43,Game Developer,At office,2025-10-21 08:45:56
Senior-Lead Product Owner / Product Manager,M_Service (MoMo),Ho Chi Minh,"Product Owner, Business Analysis, UI-UX",2025-09-26 08:35:09,https://itviec.com/it-jobs/senior-lead-product-owner-product-manager-m_service-momo-5630/content?job_index=3&locale=en&page=43,Product Owner,At office,2025-10-21 08:45:56
Backend Engineer (AI-driven Solutions),Trusting Social,Ho Chi Minh,"Python, SQL, AI, LLM, NodeJS, Golang",2025-09-26 08:35:10,https://itviec.com/it-jobs/backend-engineer-ai-driven-solutions-trusting-social-5706/content?job_index=4&locale=en&page=43,Backend Developer,At office,2025-10-21 08:45:56
"Technical Project Manager (AWS, Cloud, Azure)",OL Vietnam,Ho Chi Minh,"Project Management, Leadership, AI, Azure, Cloud, AWS",2025-09-26 08:35:12,https://itviec.com/it-jobs/technical-project-manager-aws-cloud-azure-ol-vietnam-1250/content?job_index=5&locale=en&page=43,Project Manager,At office,2025-10-21 08:45:56
"Technical Lead (Typescript, Java, Javascript, C++, C#)",BinarixTech,Ho Chi Minh,"Team Management, C#, C++, TypeScript, JavaScript, Java",2025-09-26 08:35:14,https://itviec.com/it-jobs/technical-lead-typescript-java-javascript-c-c-binarixtech-5555/content?job_index=6&locale=en&page=43,Manager,At office,2025-10-21 08:45:56
IT Business Analyst (Senior BA),Dai-ichi Life Việt Nam,Ho Chi Minh,"Business Analysis, SQL, English",2025-09-26 08:35:15,https://itviec.com/it-jobs/it-business-analyst-senior-ba-dai-ichi-life-viet-nam-5815/content?job_index=7&locale=en&page=43,Business Analyst,At office,2025-10-21 08:45:56
"[Sign-On Bonus] Fullstack Dev (ReactJS, VueJS, NodeJS)",airCloset Engineering,Ha Noi,"NodeJS, ReactJS, JavaScript, AWS, VueJS",2025-09-26 08:35:17,https://itviec.com/it-jobs/sign-on-bonus-fullstack-dev-reactjs-vuejs-nodejs-aircloset-engineering-5158/content?job_index=8&locale=en&page=43,Fullstack Developer,At office,2025-10-21 08:45:56
Senior Data Engineer,Vulcan Labs,Ho Chi Minh,"Python, SQL",2025-09-26 08:35:19,https://itviec.com/it-jobs/senior-data-engineer-vulcan-labs-5532/content?job_index=9&locale=en&page=43,Data Engineer,At office,2025-10-21 08:45:56
Senior QC Engineer (Tester),One Mount Group,Ha Noi,"QA QC, SQL, SoapUI, Postman, Automation Test, Tester",2025-09-26 08:35:20,https://itviec.com/it-jobs/senior-qc-engineer-tester-one-mount-group-4305/content?job_index=10&locale=en&page=43,Manual Tester,At office,2025-10-21 08:45:56
Middle/Senior Python Developer,MenuCoster,Ha Noi - Ho Chi Minh - Da Nang,"Python, scikit-learn, API, Database, SQL",2025-09-26 08:35:22,https://itviec.com/it-jobs/middle-senior-python-developer-menucoster-1410/content?job_index=11&locale=en&page=43,Backend Developer,At office,2025-10-21 08:45:56
Front-End Focused FullStack Dev (React/Typescript),Aviation Software Innovation,Ho Chi Minh,"ReactJS, HTML, Microservices, Spring Boot, CSS, JavaScript",2025-09-26 08:35:24,https://itviec.com/it-jobs/front-end-focused-fullstack-dev-react-typescript-aviation-software-innovation-4749/content?job_index=12&locale=en&page=43,Fullstack Developer,Hybrid (flexible between home and office),2025-10-21 08:45:56
"Full Stack Developer (Java, JavaScript)",mgm technology partners Vietnam,Ho Chi Minh - Da Nang,"JavaScript, ReactJS, Java",2025-09-26 08:35:25,https://itviec.com/it-jobs/full-stack-developer-java-javascript-mgm-technology-partners-vietnam-2057/content?job_index=13&locale=en&page=43,Fullstack Developer,Hybrid (flexible between home and office),2025-10-21 08:45:56
Business Analyst,XT Solution,Ho Chi Minh,"Business Analysis, SQL, Scrum, Agile, Jira",2025-09-26 08:35:27,https://itviec.com/it-jobs/business-analyst-xt-solution-2527/content?job_index=14&locale=en&page=43,Business Analyst,At office,2025-10-21 08:45:56
[Team Leader] AI/ML Engineer,"ARSEN Kawaijuku Tech Vietnam Co.,Ltd",Ho Chi Minh,"AI, Machine Learning, SQL, C++, Python, Team Management",2025-09-26 08:35:28,https://itviec.com/it-jobs/team-leader-ai-ml-engineer-arsen-kawaijuku-tech-vietnam-co-ltd-1842/content?job_index=15&locale=en&page=43,AI / Machine Learning Engineer,At office,2025-10-21 08:45:56
"IT Tech Lead (PHP|Laravel, NextJS)",The One Digi Corp,Ho Chi Minh,"PHP, JavaScript, CSS, HTML, Laravel, NextJS",2025-09-26 08:35:30,https://itviec.com/it-jobs/it-tech-lead-php-laravel-nextjs-the-one-digi-corp-2455/content?job_index=16&locale=en&page=43,Manager,At office,2025-10-21 08:45:56
VIC - AI Engineer (Machine Learning/ Deep Learning),Viettel Group,Ha Noi,"AI, SQL, Java, Python, Deep Learning, Machine Learning",2025-09-26 08:35:32,https://itviec.com/it-jobs/vic-ai-engineer-machine-learning-deep-learning-viettel-group-5114/content?job_index=17&locale=en&page=43,AI / Machine Learning Engineer,At office,2025-10-21 08:45:56
Business Analyst (Entry-Level),DIGIBANK SOLUTIONS,Da Nang - Ha Noi,"Business Analysis, Project Management, Technical Writing, IT Communication/Translation, Data Analysis",2025-09-26 08:35:33,https://itviec.com/it-jobs/business-analyst-entry-level-digibank-solutions-2411/content?job_index=18&locale=en&page=43,Business Analyst,At office,2025-10-21 08:45:56
Senior Backend Engineer (Go/ Rust/ NodeJS/ Blockchain),One Mount Group,Ha Noi,"Golang, Microservices, NoSQL, Blockchain, NodeJS, Rust",2025-09-26 08:35:35,https://itviec.com/it-jobs/senior-backend-engineer-go-rust-nodejs-blockchain-one-mount-group-3834/content?job_index=19&locale=en&page=43,Backend Developer,At office,2025-10-21 08:45:56
